{
  "artifact_type": "dep_chain_regression_pack",
  "schema_version": "1.0.0",
  "artifact_version": "1.0.0",
  "standards_version": "1.0.0",
  "artifact_id": "dep_chain_regression_pack-example",
  "owner": "DEP",
  "created_at": "2026-04-15T00:00:00Z",
  "status": "pass",
  "reason_codes": [
    "example_payload"
  ],
  "evidence_refs": [
    "evidence:example"
  ],
  "non_authority_assertions": [
    "example_non_authority"
  ]
}
